{
  "schema_version": "weave.remote_event.v1",
  "id": "evt_forgejo_1720000000_987654321",
  "producer": {
    "name": "forgejo-adapter",
    "version": "0.1.0"
  },
  "produced_at": "2026-07-01T00:00:05Z",
  "occurred_at": "2026-07-01T00:00:01Z",
  "correlation_id": "forgejo:misty-step/bitterblossom:pull_request:882:opened",
  "source": {
    "kind": "forgejo",
    "host": "forgejo.example.invalid",
    "external_id": "delivery-987654321",
    "url": "https://forgejo.example.invalid/misty-step/bitterblossom/pulls/882"
  },
  "repository": {
    "id": "forgejo-repo-915001",
    "full_name": "misty-step/bitterblossom",
    "default_branch": "master",
    "html_url": "https://forgejo.example.invalid/misty-step/bitterblossom",
    "api_url": "https://forgejo.example.invalid/api/v1/repos/misty-step/bitterblossom",
    "clone_url": "https://forgejo.example.invalid/misty-step/bitterblossom.git"
  },
  "subject": {
    "kind": "pull_request",
    "id": "882",
    "number": 882,
    "url": "https://forgejo.example.invalid/misty-step/bitterblossom/pulls/882"
  },
  "actor": {
    "id": "forgejo-user-42",
    "login": "codex-worker",
    "kind": "bot"
  },
  "action": "opened",
  "idempotency_key": "forgejo:delivery-987654321:pull_request:882:opened:115176f000000000000000000000000000000000",
  "host_payload": {
    "event_name": "pull_request",
    "delivery_id": "delivery-987654321",
    "links": [
      {
        "rel": "html",
        "href": "https://forgejo.example.invalid/misty-step/bitterblossom/pulls/882"
      },
      {
        "rel": "api",
        "href": "https://forgejo.example.invalid/api/v1/repos/misty-step/bitterblossom/pulls/882"
      },
      {
        "rel": "diff",
        "href": "https://forgejo.example.invalid/misty-step/bitterblossom/pulls/882.diff"
      },
      {
        "rel": "patch",
        "href": "https://forgejo.example.invalid/misty-step/bitterblossom/pulls/882.patch"
      }
    ]
  },
  "policy": {
    "merge_policy": "agent-mergeable",
    "source": "branch-prefix",
    "reason": "factory/* branch generated by an authenticated agent lane",
    "labels": [
      "agent-authored"
    ]
  },
  "payload": {
    "base_ref": "master",
    "head_ref": "factory/seam-contracts-bb-outbound",
    "head_sha": "115176f000000000000000000000000000000000",
    "draft": false,
    "state": "open"
  }
}
