{
  "schema_version": "weave.remote_event.v1",
  "id": "evt_github_1720000000_123456789",
  "producer": {
    "name": "github-adapter",
    "version": "0.1.0"
  },
  "produced_at": "2026-07-01T00:00:04Z",
  "occurred_at": "2026-07-01T00:00:00Z",
  "correlation_id": "github:misty-step/bitterblossom:pull_request:882:opened",
  "source": {
    "kind": "github",
    "host": "github.com",
    "external_id": "delivery-123456789",
    "url": "https://github.com/misty-step/bitterblossom/pull/882"
  },
  "repository": {
    "id": "github-repo-915001",
    "full_name": "misty-step/bitterblossom",
    "default_branch": "master",
    "html_url": "https://github.com/misty-step/bitterblossom",
    "api_url": "https://api.github.com/repos/misty-step/bitterblossom",
    "clone_url": "https://github.com/misty-step/bitterblossom.git"
  },
  "subject": {
    "kind": "pull_request",
    "id": "882",
    "number": 882,
    "url": "https://github.com/misty-step/bitterblossom/pull/882"
  },
  "actor": {
    "id": "github-user-42",
    "login": "codex-worker",
    "kind": "bot"
  },
  "action": "opened",
  "idempotency_key": "github:delivery-123456789:pull_request:882:opened:115176f000000000000000000000000000000000",
  "host_payload": {
    "event_name": "pull_request",
    "delivery_id": "delivery-123456789",
    "api_version": "2022-11-28",
    "links": [
      {
        "rel": "html",
        "href": "https://github.com/misty-step/bitterblossom/pull/882"
      },
      {
        "rel": "api",
        "href": "https://api.github.com/repos/misty-step/bitterblossom/pulls/882"
      },
      {
        "rel": "diff",
        "href": "https://github.com/misty-step/bitterblossom/pull/882.diff"
      },
      {
        "rel": "patch",
        "href": "https://github.com/misty-step/bitterblossom/pull/882.patch"
      }
    ]
  },
  "policy": {
    "merge_policy": "agent-mergeable",
    "source": "branch-prefix",
    "reason": "factory/* branch generated by an authenticated agent lane",
    "labels": [
      "agent-authored"
    ]
  },
  "payload": {
    "base_ref": "master",
    "head_ref": "factory/seam-contracts-bb-outbound",
    "head_sha": "115176f000000000000000000000000000000000",
    "draft": false,
    "state": "open"
  }
}
